{
  "$schema": "https://json-schema.org/draft/2020-12/schema",
  "$id": "https://aegis.dev/schemas/statusline.schema.json",
  "title": "Aegis Statusline Preset Descriptor",
  "description": "One statusline.json per preset folder under statuslines/<name>/. Lean 5-field surface frontmatter expressed as top-level JSON keys, plus statusline-specific config (theme, segments, mergeGroups, refreshIntervalSeconds).",
  "type": "object",
  "required": ["kind", "name", "description", "visibility", "platforms", "theme", "segments"],
  "properties": {
    "kind": {
      "const": "statusline"
    },
    "name": {
      "type": "string",
      "pattern": "^[a-z][a-z0-9-]*$",
      "maxLength": 64,
      "description": "Preset folder name (kebab-case). Must match the containing folder."
    },
    "description": {
      "type": "string",
      "minLength": 1,
      "maxLength": 1536
    },
    "visibility": {
      "type": "string",
      "enum": ["user", "internal"]
    },
    "platforms": {
      "type": "array",
      "items": { "type": "string", "enum": ["claude", "opencode", "codex", "cursor", "zed"] },
      "minItems": 1,
      "uniqueItems": true,
      "description": "Hosts that render this preset. At v0.0.4 only `claude` has a real projection; other hosts are honest gaps. Preset content stays host-agnostic so a future hook can render it."
    },
    "source": {
      "type": "string",
      "minLength": 1,
      "description": "Provenance string for migrated/derived presets, e.g. 'claude-hud:Essential'."
    },
    "theme": {
      "type": "string",
      "pattern": "^[a-z][a-z0-9-]*$",
      "description": "Name of a palette under statuslines/_shared/themes/<theme>.json (e.g. mono, default, tokyo-night, gruvbox-dark)."
    },
    "segments": {
      "type": "array",
      "minItems": 1,
      "description": "Ordered status lines. Each element is one rendered line: an ordered array of segment IDs joined left-to-right. Multiple elements render as multiple lines (top to bottom).",
      "items": {
        "type": "array",
        "minItems": 1,
        "items": {
          "type": "string",
          "enum": [
            "model",
            "project",
            "added-dirs",
            "git",
            "worktree",
            "pr",
            "effort",
            "context",
            "context-detailed",
            "usage",
            "prompt-cache",
            "cost",
            "tools",
            "agents",
            "todos",
            "task-banner",
            "claude-md",
            "session-time",
            "custom-line"
          ]
        }
      }
    },
    "separator": {
      "type": "string",
      "maxLength": 8,
      "description": "OPTIONAL. The inter-segment separator GLYPH (e.g. '·' or '|'), NOT including surrounding spaces — the runtime wraps it in a single space on each side and colorizes it with the theme 'separator' key. Default '·' when absent, matching pre-existing behavior."
    },
    "mergeGroups": {
      "type": "array",
      "description": "OPTIONAL (honored since v0.0.14). Each inner array lists segment IDs that render with NO separator between them (a tight visual group, joined by `mergeSeparator` — default empty string). A segment may appear in at most one group. Segments not in any group keep the normal separator. Ordering of the group within a line follows the first member's position in that line's `segments` array.",
      "items": {
        "type": "array",
        "items": { "type": "string" },
        "minItems": 2
      }
    },
    "mergeSeparator": {
      "type": "string",
      "maxLength": 8,
      "description": "OPTIONAL (v0.0.14). String inserted BETWEEN members of a mergeGroup (default \"\" — no separator). E.g. \"/\" to render git+pr as `main/#247`."
    },
    "order": {
      "type": "array",
      "items": { "type": "string" },
      "uniqueItems": true,
      "description": "OPTIONAL (v0.0.14). Explicit segment-priority list. When present, every line's segments are STABLE-SORTED by their index in this list (segments absent from `order` keep their relative position, sorted after listed ones). Additive: omit to keep the authored `segments` order. Does not add or remove segments — only reorders within each line."
    },
    "thresholds": {
      "type": "object",
      "description": "OPTIONAL (v0.0.14). Threshold escalation: per-metric ordered breakpoints that map a numeric value to a theme color key, so a segment can escalate (e.g. context usage green → warning → critical). The runtime resolves the matching color key and exposes it to segments via `ctx.threshold(metric, value)`; segments opt in to honoring it. Existing presets omit this and render exactly as before.",
      "additionalProperties": {
        "type": "array",
        "minItems": 1,
        "description": "Ordered breakpoints for one metric, evaluated top-to-bottom; the FIRST whose `at` is <= value wins. List from highest `at` to lowest.",
        "items": {
          "type": "object",
          "required": ["at", "color"],
          "properties": {
            "at": { "type": "number", "description": "Inclusive lower bound (value >= at matches)." },
            "color": {
              "type": "string",
              "pattern": "^[a-zA-Z][a-zA-Z0-9_-]*$",
              "description": "Theme color KEY (resolved against the active palette's colors.*, e.g. 'warning', 'critical')."
            },
            "label": {
              "type": "string",
              "maxLength": 64,
              "description": "OPTIONAL severity label a segment may surface (e.g. 'HIGH')."
            }
          },
          "additionalProperties": false
        }
      }
    },
    "i18n": {
      "type": "object",
      "description": "OPTIONAL (v0.0.14). Localizable labels. The runtime exposes `ctx.t(key)` returning `labels[key]` (falling back to the key itself). Additive: presets without i18n render English/literal labels exactly as before.",
      "required": ["labels"],
      "properties": {
        "locale": {
          "type": "string",
          "pattern": "^[a-z]{2}(-[A-Z]{2})?$",
          "description": "BCP-47-ish locale tag (e.g. 'en', 'pt-BR'). Advisory metadata; the runtime keys off `labels` directly."
        },
        "labels": {
          "type": "object",
          "minProperties": 1,
          "additionalProperties": { "type": "string", "maxLength": 128 },
          "description": "Label-key → localized string. Keys are segment-defined label slugs (e.g. 'ctx', 'cost')."
        }
      },
      "additionalProperties": false
    },
    "refreshIntervalSeconds": {
      "type": "integer",
      "minimum": 0,
      "maximum": 3600,
      "description": "Set ONLY for presets containing time-based segments (usage countdown, session-time, prompt-cache TTL, pr review-state drift). Event-driven presets omit this. 0 or absent = event-only."
    }
  },
  "additionalProperties": false,
  "patternProperties": {
    "^x-[a-z][a-z0-9-]*$": {
      "type": "object",
      "description": "Adapter-specific overrides (e.g. x-claude)."
    }
  }
}
